{
  "$schema": "http://json-schema.org/draft-07/schema#",
  "title": "Level",
  "description": "One level. The folder name is the level id. A path like backgrounds/room.webp is inside this level. A path starting with / is from content/, for shared files: /shared/backgrounds/room.webp.",
  "type": "object",
  "required": ["scenes"],
  "additionalProperties": false,
  "properties": {
    "$schema": { "type": "string" },
    "name": {
      "type": "string",
      "description": "Label shown in tools. Defaults to the folder name."
    },
    "startScene": {
      "type": "string",
      "description": "Scene id opened when the level starts. Defaults to the first scene."
    },
    "ambience": {
      "$ref": "#/definitions/cue",
      "description": "Looping background sound for the whole level. A scene can replace it with its own."
    },
    "scenes": {
      "type": "object",
      "description": "Scenes keyed by id. The id is used by startScene and by other files.",
      "minProperties": 1,
      "additionalProperties": { "$ref": "#/definitions/scene" }
    }
  },
  "definitions": {
    "scene": {
      "type": "object",
      "additionalProperties": false,
      "properties": {
        "name": {
          "type": "string",
          "description": "Label shown in tools. Defaults to the scene id."
        },
        "fit": {
          "enum": ["width", "cover", "contain"],
          "default": "cover",
          "description": "width touches the left and right edges and crops the top and bottom. cover fills the screen and crops the overflow. contain shows the whole image with bars around it."
        },
        "look": {
          "type": "boolean",
          "default": true,
          "description": "False holds the camera still. Menus use this so buttons do not slide."
        },
        "background": {
          "type": "string",
          "description": "Background image. Shared art uses /shared/backgrounds/room.webp. An animated WebP loops. Leave it out for a dark placeholder."
        },
        "characters": {
          "type": "array",
          "items": { "$ref": "#/definitions/character" }
        },
        "dialogue": {
          "type": "string",
          "description": "Ink knot from content/story/story.ink, played when the scene opens, before onEnter."
        },
        "ambience": {
          "$ref": "#/definitions/cue",
          "description": "Replaces the level ambience while this scene is open."
        },
        "onEnter": {
          "type": "array",
          "description": "Actions run when the scene opens, after dialogue.",
          "items": { "$ref": "#/definitions/action" }
        },
        "triggers": {
          "type": "array",
          "description": "Click boxes, in pixels of the background. A label draws a button. Without a label the box is invisible. The debug panel can draw every box.",
          "items": { "$ref": "#/definitions/trigger" }
        },
        "texts": {
          "type": "array",
          "description": "Lines of text, in pixels of the background. They are not clickable.",
          "items": { "$ref": "#/definitions/text" }
        }
      }
    },
    "cue": {
      "type": "object",
      "required": ["file"],
      "additionalProperties": false,
      "properties": {
        "file": {
          "type": "string",
          "description": "Looping sound. Shared audio uses /shared/audio/room.ogg."
        },
        "volume": {
          "type": "number",
          "minimum": 0,
          "maximum": 1,
          "default": 1
        }
      }
    },
    "trigger": {
      "type": "object",
      "required": ["id", "x", "y", "width", "height", "actions"],
      "additionalProperties": false,
      "properties": {
        "id": {
          "type": "string",
          "description": "Name used in tools and error messages."
        },
        "label": {
          "type": "string",
          "description": "Drawn as a button. Leave it out for an invisible hotspot."
        },
        "once": {
          "type": "boolean",
          "default": true,
          "description": "The trigger disappears after it runs. False keeps it clickable. Omitted means true."
        },
        "x": {
          "type": "number",
          "description": "Center of the rectangle, in pixels of the background."
        },
        "y": {
          "type": "number",
          "description": "Center of the rectangle, in pixels of the background."
        },
        "width": { "type": "number", "exclusiveMinimum": 0 },
        "height": { "type": "number", "exclusiveMinimum": 0 },
        "actions": {
          "type": "array",
          "description": "Run in order on click. sound does not wait. dialogue waits. go, level, and quit stop the list.",
          "items": { "$ref": "#/definitions/action" }
        }
      }
    },
    "action": {
      "oneOf": [
        {
          "type": "object",
          "required": ["sound"],
          "additionalProperties": false,
          "properties": {
            "sound": {
              "type": "string",
              "description": "Sound file. Shared audio uses /shared/audio/click.wav."
            },
            "volume": { "type": "number", "minimum": 0, "maximum": 1, "default": 1 }
          }
        },
        {
          "type": "object",
          "required": ["dialogue"],
          "additionalProperties": false,
          "properties": {
            "dialogue": {
              "type": "string",
              "description": "Ink knot name from content/story/story.ink, such as intro."
            }
          }
        },
        {
          "type": "object",
          "required": ["go"],
          "additionalProperties": false,
          "properties": {
            "go": {
              "type": "string",
              "description": "Scene id in this same level."
            }
          }
        },
        {
          "type": "object",
          "required": ["level"],
          "additionalProperties": false,
          "properties": {
            "level": {
              "type": "string",
              "description": "Level folder name to open, such as level-1."
            }
          }
        },
        {
          "type": "object",
          "required": ["fullscreen"],
          "additionalProperties": false,
          "properties": {
            "fullscreen": {
              "type": "boolean",
              "const": true,
              "description": "Switches between the window and the whole screen. The button label shows On or Off."
            }
          }
        },
        {
          "type": "object",
          "required": ["dev"],
          "additionalProperties": false,
          "properties": {
            "dev": {
              "type": "boolean",
              "const": true,
              "description": "Shows or hides the debug panel and the scene tools. Works in a published build."
            }
          }
        },
        {
          "type": "object",
          "required": ["shop"],
          "additionalProperties": false,
          "properties": {
            "shop": {
              "type": "boolean",
              "const": true,
              "description": "Opens the shop on the menu, where decor and maps can be bought."
            }
          }
        },
        {
          "type": "object",
          "required": ["focus"],
          "additionalProperties": false,
          "properties": {
            "focus": {
              "type": "boolean",
              "const": true,
              "description": "Black screen to pick a focus length, then a short monologue, then the first level. The length stays at one minute."
            }
          }
        },
        {
          "type": "object",
          "required": ["quit"],
          "additionalProperties": false,
          "properties": {
            "quit": {
              "type": "boolean",
              "const": true,
              "description": "Closes the window. If the browser keeps the tab, the player is asked to close it."
            }
          }
        },
        {
          "type": "object",
          "required": ["shake"],
          "additionalProperties": false,
          "properties": {
            "shake": {
              "description": "true uses the default shake. An object can set intensity (pixels) and duration (milliseconds).",
              "oneOf": [
                { "type": "boolean", "const": true },
                {
                  "type": "object",
                  "additionalProperties": false,
                  "properties": {
                    "intensity": { "type": "number", "minimum": 0 },
                    "duration": { "type": "number", "minimum": 0 }
                  }
                }
              ]
            }
          }
        }
      ]
    },
    "text": {
      "type": "object",
      "required": ["text", "x", "y"],
      "additionalProperties": false,
      "properties": {
        "text": { "type": "string" },
        "x": { "type": "number", "description": "Center of the line, in pixels of the background." },
        "y": { "type": "number", "description": "Center of the line, in pixels of the background." },
        "size": { "type": "number", "exclusiveMinimum": 0, "default": 32 }
      }
    },
    "character": {
      "type": "object",
      "required": ["image", "x", "y"],
      "additionalProperties": false,
      "properties": {
        "image": {
          "type": "string",
          "description": "Character image. Shared art uses /shared/characters/hana.webp. An animated WebP loops."
        },
        "x": {
          "type": "number",
          "description": "Center of the character, in pixels of the background image."
        },
        "y": {
          "type": "number",
          "description": "Center of the character, in pixels of the background image."
        },
        "scale": {
          "type": "number",
          "exclusiveMinimum": 0,
          "default": 1,
          "description": "Relative to the background. 1 keeps the image's own pixel size."
        }
      }
    }
  }
}
