{
  "$schema": "../../schemas/level.schema.json",
  "name": "Level 3",
  "startScene": "study",
  "ambience": { "file": "/shared/audio/bg_chill_guitar.wav", "volume": 0.5 },
  "scenes": {
    "study": {
      "name": "Study",
      "fit": "width",
      "look": true,
      "background": "night-study.webp"
    }
  }
}
