{
  "$schema": "../../schemas/level.schema.json",
  "name": "Level 2",
  "startScene": "study",
  "ambience": { "file": "/shared/audio/riseup.mp3", "volume": 0.7 },
  "scenes": {
    "study": {
      "name": "Study",
      "fit": "width",
      "look": true,
      "background": "day-study-no-iris.jpg"
    }
  }
}
